<?xml version="1.0" encoding="UTF-8"?>
<contacts xmlns:xsi="http://www.w3.org/2001/XMLSchema-instance" xsi:noNamespaceSchemaLocation="contacts_schema.xsd">


    <employee>
        <name>mukammed</name>
        <phone>5434</phone>
        <address>717 Ibn Easel St Azzaheria</address>
        <email>Muhammed@gmail.com</email>
    </employee>
    <employee>
        <name>Ali</name>
        <phone>5434</phone>
        <address>717 Ibn Easel St Azzaheria</address>
        <email>Muhammed@gmail.com</email>
    </employee>
</contacts>
